{"attempt":{"attempt_id":"post-promotion-20260906-r4","previous_receipt":null,"root_cause_id":null,"same_root_cause_failure_count":0},"carried_gate_ids":[],"completed_at_utc":"2026-09-06T13:56:35+00:00","effective_gates":[{"architecture":"linux/arm64","carried_from_attempt":null,"command":["go","test","./internal/service","-run","^TestUploadOfficialCodexFileC2PAReservationReusesCreateBodyOnRetry$","-count=1"],"completed_at_utc":"2026-09-06T13:56:31+00:00","disposition":"executed","evidence":[{"bytes":1256,"path":"post-promotion-gates/affected-spec-ep-002.evidence.json","sha256":"17fe8550303e16496536cc811e3cdb5b122731c1dd135cf5fe431dbc61a029b5"}],"exit_code":0,"failed_count":0,"gate_id":"affected-spec-ep-002","host":"22-7-28-0641","passed_count":1,"skipped_count":0,"started_at_utc":"2026-09-06T13:56:29+00:00","status":"passed","stderr_sha256":"00f257f147a83a2ab9fee250b3cb0f035bbfed56065348f75a9f8092855fabb3","stdout_sha256":"c26de83abdc9496cd1301470918ec39ecca1cf389ef0ae1c6504da1800d1c431","working_directory":"backend"},{"architecture":"linux/arm64","carried_from_attempt":null,"command":["go","test","./internal/service","-run","^TestCandidateTraceCodex0145RuntimeAndBoundaryFacts$","-count=1"],"completed_at_utc":"2026-09-06T13:56:31+00:00","disposition":"executed","evidence":[{"bytes":1229,"path":"post-promotion-gates/affected-spec-hdr-005.evidence.json","sha256":"a80721d05452a87b4d08a89f827af57d580e90917330d9c9bca7b674e0f02e2b"}],"exit_code":0,"failed_count":0,"gate_id":"affected-spec-hdr-005","host":"22-7-28-0641","passed_count":1,"skipped_count":0,"started_at_utc":"2026-09-06T13:56:31+00:00","status":"passed","stderr_sha256":"00f257f147a83a2ab9fee250b3cb0f035bbfed56065348f75a9f8092855fabb3","stdout_sha256":"8578b827859898fff287492446b0ba27398a4eb65016a99056312fe051664aa4","working_directory":"backend"},{"architecture":"linux/arm64","carried_from_attempt":null,"command":["go","test","./internal/service","-run","^TestOfficialCodexProjectionUsesFormalReleaseCatalog$","-count=1"],"completed_at_utc":"2026-09-06T13:56:32+00:00","disposition":"executed","evidence":[{"bytes":1222,"path":"post-promotion-gates/catalog-projection.evidence.json","sha256":"6239c577ff1b62730a5479a2575620746be13b589ca1fbfe3e011d10743e8057"}],"exit_code":0,"failed_count":0,"gate_id":"catalog-projection","host":"22-7-28-0641","passed_count":1,"skipped_count":0,"started_at_utc":"2026-09-06T13:56:31+00:00","status":"passed","stderr_sha256":"26d4330a4cb0381d25b004401612e917fa06bf09b3b6aee70972a0186b5e8ff3","stdout_sha256":"c26de83abdc9496cd1301470918ec39ecca1cf389ef0ae1c6504da1800d1c431","working_directory":"backend"},{"architecture":"linux/arm64","carried_from_attempt":null,"command":["go","test","./internal/service","-run","^TestOfficialEgressVersionLeakAST$","-count=1"],"completed_at_utc":"2026-09-06T13:56:33+00:00","disposition":"executed","evidence":[{"bytes":1226,"path":"post-promotion-gates/official-egress-version-leak-ast.evidence.json","sha256":"549a788ef3fe85b7d4fcc74d8b58eb0b59a89ce4a33d08e9a9b98411aeee85bc"}],"exit_code":0,"failed_count":0,"gate_id":"official-egress-version-leak-ast","host":"22-7-28-0641","passed_count":1,"skipped_count":0,"started_at_utc":"2026-09-06T13:56:32+00:00","status":"passed","stderr_sha256":"26d4330a4cb0381d25b004401612e917fa06bf09b3b6aee70972a0186b5e8ff3","stdout_sha256":"c26de83abdc9496cd1301470918ec39ecca1cf389ef0ae1c6504da1800d1c431","working_directory":"backend"},{"architecture":"linux/arm64","carried_from_attempt":null,"command":["python3","tools/check_version_leak.py"],"completed_at_utc":"2026-09-06T13:56:35+00:00","disposition":"executed","evidence":[{"bytes":617,"path":"post-promotion-gates/version-leak.evidence.json","sha256":"2c54317087e02264edca2b8ce71f557160a4a4feb145a3ffa026c8a6e4980e69"}],"exit_code":0,"failed_count":0,"gate_id":"version-leak","host":"22-7-28-0641","passed_count":1,"skipped_count":0,"started_at_utc":"2026-09-06T13:56:33+00:00","status":"passed","stderr_sha256":"e3b0c44298fc1c149afbf4c8996fb92427ae41e4649b934ca495991b7852b855","stdout_sha256":"dc84d7443b63bac2ee6f5c925ca5c1fa565ae63a6459d0a106b51fbb56987d27","working_directory":"."},{"architecture":"linux/arm64","carried_from_attempt":null,"command":["python3","tools/check_version_leak.py","--self-test"],"completed_at_utc":"2026-09-06T13:56:35+00:00","disposition":"executed","evidence":[{"bytes":685,"path":"post-promotion-gates/version-leak-self-test.evidence.json","sha256":"09d4ca596b095059850e04820a244ad7654de456247b228608a5802f2205e789"}],"exit_code":0,"failed_count":0,"gate_id":"version-leak-self-test","host":"22-7-28-0641","passed_count":1,"skipped_count":0,"started_at_utc":"2026-09-06T13:56:35+00:00","status":"passed","stderr_sha256":"e3b0c44298fc1c149afbf4c8996fb92427ae41e4649b934ca495991b7852b855","stdout_sha256":"a6ded027ecd76186bca3df4ab2536f00d115b6af49ca898b26ca6e33461cd30e","working_directory":"."}],"environment":{"after":{"bytes":883,"path":"post-promotion-gates/environment-after-receipt.json","sha256":"2b4372bb27005aaa1fd32d2b54df59906e852cc271a2049bd416cf0c3da25455"},"before":{"bytes":885,"path":"post-promotion-gates/environment-before-receipt.json","sha256":"30dd2650c743cbf4c78cf2b1b0befac92f586df5a1d120f5d9ac2d48e6c90f60"},"continuity_identity_sha256":"fb7fd87694bb51aee3ffe4538b5482c1206888ba17165efd40eec201b7d97e10"},"executed_gate_ids":["affected-spec-ep-002","affected-spec-hdr-005","catalog-projection","official-egress-version-leak-ast","version-leak","version-leak-self-test"],"failed_gate_ids":[],"inputs":[{"bytes":2618,"path":"inputs/acceptance.json","role":"acceptance","sha256":"547768c0edc4be7b6d0206140d6c8a453d5a867a4bf8339f7a8e806421a9cbb3"},{"bytes":2885,"path":"inputs/promotion.json","role":"promotion","sha256":"2592a01114bdea0f7d873b13b993c0098d77c72a9eea64f9bc1385ed057fa223"}],"passed_gate_ids":["affected-spec-ep-002","affected-spec-hdr-005","catalog-projection","official-egress-version-leak-ast","version-leak","version-leak-self-test"],"phase":"post_promotion","producer":{"facts":{"bytes":7803,"path":"post-promotion-gates/facts.json","sha256":"131a8e44c04a2609448dc8707a6fa0ac37d08193d559dd0e515ef2cdf6d114f3"},"schema_version":"codex-upgrade-external-gate-producer/v3","tool":"/root/oauth-capture/tools/official_client_capture/codex_upgrade_gate_receipt.py","tool_sha256":"5c925115f6c210212fed1a3a87f2ce8beb9e1588d4a0ddfa08d39c026a5a1a31"},"schema_version":"codex-upgrade-external-gate-receipt/v3","status":"passed","subject":{"acceptance_sha256":"547768c0edc4be7b6d0206140d6c8a453d5a867a4bf8339f7a8e806421a9cbb3","campaign_id":"c0151-formal-rule-correction-20260905t0033z","campaign_mode":"formal","campaign_purpose":"production_replacement","candidate_id":"c0151-v10-c1","candidate_image_id":"sha256:de96a14c02b03db37b960e61a32f38e6e84b9afb408bfb282378e608974a9fda","candidate_image_reference":"sub2apiplus-c0151-v10-candidate@sha256:de96a14c02b03db37b960e61a32f38e6e84b9afb408bfb282378e608974a9fda","candidate_package_digest":"41a9ba84b407cb9b6ee7f4f10c07f5c8aa0fa0d9d27c0ba59c8df0b919bb746c","candidate_purpose":"production_replacement","candidate_source_tree_sha256":"d90816dd26551feff23193e8f726e0707141ad490a172af3b579f037d3e8b289","production_tree_sha256":"8bf3b3d3f0db05b76a3999173cc363cca555aaac6ce7da7cd6099684d4b436e1","profile_digest":"dbc65378c80a2ad843ce1ba6253a2e47f0dd5d8bc812bb536a2d24ddb7a59e39","profile_id":"codex-0.151.0-official-r151-v1","promotion_receipt_sha256":"2592a01114bdea0f7d873b13b993c0098d77c72a9eea64f9bc1385ed057fa223","target_architecture":"linux/arm64","target_version":"0.151.0"}}
